[
  {
    "antipope_id": "antipope-001",
    "claimant_name": "Natalius",
    "slug": "natalius-1",
    "claim_period": "c. 199–200",
    "status": "antipope",
    "included_in_canonical_popes": false,
    "notes": "In opposition to Zephyrinus; later reconciled."
  },
  {
    "antipope_id": "antipope-002",
    "claimant_name": "Hippolytus",
    "slug": "hippolytus-2",
    "claim_period": "217–235",
    "status": "antipope",
    "included_in_canonical_popes": false,
    "notes": "In opposition to Callixtus I, Urban I, and Pontian; later reconciled."
  },
  {
    "antipope_id": "antipope-003",
    "claimant_name": "Novatian",
    "slug": "novatian-3",
    "claim_period": "251–258",
    "status": "antipope",
    "included_in_canonical_popes": false,
    "notes": "Founder of Novatianism; in opposition to Cornelius and successors."
  },
  {
    "antipope_id": "antipope-004",
    "claimant_name": "Felix II",
    "slug": "felix-ii-4",
    "claim_period": "355–365",
    "status": "antipope",
    "included_in_canonical_popes": false,
    "notes": "Often treated historically as an antipope."
  },
  {
    "antipope_id": "antipope-005",
    "claimant_name": "Ursicinus",
    "slug": "ursicinus-5",
    "claim_period": "366–367",
    "status": "antipope",
    "included_in_canonical_popes": false,
    "notes": "In opposition to Damasus I."
  },
  {
    "antipope_id": "antipope-006",
    "claimant_name": "Eulalius",
    "slug": "eulalius-6",
    "claim_period": "418–419",
    "status": "antipope",
    "included_in_canonical_popes": false,
    "notes": "In opposition to Boniface I."
  },
  {
    "antipope_id": "antipope-007",
    "claimant_name": "Laurence",
    "slug": "laurence-7",
    "claim_period": "498–506",
    "status": "antipope",
    "included_in_canonical_popes": false,
    "notes": "In opposition to Symmachus."
  },
  {
    "antipope_id": "antipope-008",
    "claimant_name": "Dioscorus",
    "slug": "dioscorus-8",
    "claim_period": "530",
    "status": "antipope",
    "included_in_canonical_popes": false,
    "notes": "In opposition to Boniface II."
  },
  {
    "antipope_id": "antipope-009",
    "claimant_name": "Theodore",
    "slug": "theodore-9",
    "claim_period": "687",
    "status": "antipope",
    "included_in_canonical_popes": false,
    "notes": "Claimant during the disputed election after Conon."
  },
  {
    "antipope_id": "antipope-010",
    "claimant_name": "Paschal",
    "slug": "paschal-10",
    "claim_period": "687",
    "status": "antipope",
    "included_in_canonical_popes": false,
    "notes": "Claimant during the disputed election after Conon."
  },
  {
    "antipope_id": "antipope-011",
    "claimant_name": "Constantine II",
    "slug": "constantine-ii-11",
    "claim_period": "767–768",
    "status": "antipope",
    "included_in_canonical_popes": false,
    "notes": "In opposition before Stephen III."
  },
  {
    "antipope_id": "antipope-012",
    "claimant_name": "Philip",
    "slug": "philip-12",
    "claim_period": "768",
    "status": "antipope",
    "included_in_canonical_popes": false,
    "notes": "Claimant installed briefly during the same crisis."
  },
  {
    "antipope_id": "antipope-013",
    "claimant_name": "John VIII",
    "slug": "john-viii-13",
    "claim_period": "844",
    "status": "antipope",
    "included_in_canonical_popes": false,
    "notes": "Claimant against Sergius II; not the later canonical John VIII."
  },
  {
    "antipope_id": "antipope-014",
    "claimant_name": "Anastasius Bibliothecarius",
    "slug": "anastasius-bibliothecarius-14",
    "claim_period": "855",
    "status": "antipope",
    "included_in_canonical_popes": false,
    "notes": "In opposition to Benedict III."
  },
  {
    "antipope_id": "antipope-015",
    "claimant_name": "Christopher",
    "slug": "christopher-15",
    "claim_period": "903–904",
    "status": "antipope",
    "included_in_canonical_popes": false,
    "notes": "Formerly treated by some lists as pope; removed from the official succession."
  },
  {
    "antipope_id": "antipope-016",
    "claimant_name": "Boniface VII",
    "slug": "boniface-vii-16",
    "claim_period": "974; 984–985",
    "status": "antipope",
    "included_in_canonical_popes": false,
    "notes": "Antipope whose numbering affected later Boniface numbering."
  },
  {
    "antipope_id": "antipope-017",
    "claimant_name": "John XVI",
    "slug": "john-xvi-17",
    "claim_period": "997–998",
    "status": "antipope",
    "included_in_canonical_popes": false,
    "notes": "Antipope whose numbering affected later John numbering."
  },
  {
    "antipope_id": "antipope-018",
    "claimant_name": "Gregory VI",
    "slug": "gregory-vi-18",
    "claim_period": "1012",
    "status": "antipope",
    "included_in_canonical_popes": false,
    "notes": "In opposition to Benedict VIII; not the later canonical Gregory VI."
  },
  {
    "antipope_id": "antipope-019",
    "claimant_name": "Benedict X",
    "slug": "benedict-x-19",
    "claim_period": "1058–1059",
    "status": "antipope",
    "included_in_canonical_popes": false,
    "notes": "Excluded from canonical list and modeled here as antipope."
  },
  {
    "antipope_id": "antipope-020",
    "claimant_name": "Honorius II",
    "slug": "honorius-ii-20",
    "claim_period": "1061–1072",
    "status": "antipope",
    "included_in_canonical_popes": false,
    "notes": "Antipope Cadalus; in opposition to Alexander II."
  },
  {
    "antipope_id": "antipope-021",
    "claimant_name": "Clement III",
    "slug": "clement-iii-21",
    "claim_period": "1080–1100",
    "status": "antipope",
    "included_in_canonical_popes": false,
    "notes": "Antipope Guibert; in opposition to Gregory VII and successors."
  },
  {
    "antipope_id": "antipope-022",
    "claimant_name": "Theodoric",
    "slug": "theodoric-22",
    "claim_period": "1100–1101",
    "status": "antipope",
    "included_in_canonical_popes": false,
    "notes": "In the Clement III line."
  },
  {
    "antipope_id": "antipope-023",
    "claimant_name": "Adalbert",
    "slug": "adalbert-23",
    "claim_period": "1101",
    "status": "antipope",
    "included_in_canonical_popes": false,
    "notes": "In the Clement III line."
  },
  {
    "antipope_id": "antipope-024",
    "claimant_name": "Sylvester IV",
    "slug": "sylvester-iv-24",
    "claim_period": "1105–1111",
    "status": "antipope",
    "included_in_canonical_popes": false,
    "notes": "In opposition to Paschal II."
  },
  {
    "antipope_id": "antipope-025",
    "claimant_name": "Gregory VIII",
    "slug": "gregory-viii-25",
    "claim_period": "1118–1121",
    "status": "antipope",
    "included_in_canonical_popes": false,
    "notes": "In opposition to Gelasius II and Callixtus II."
  },
  {
    "antipope_id": "antipope-026",
    "claimant_name": "Celestine II",
    "slug": "celestine-ii-26",
    "claim_period": "1124",
    "status": "antipope",
    "included_in_canonical_popes": false,
    "notes": "Claimant after Callixtus II; not the later canonical Celestine II."
  },
  {
    "antipope_id": "antipope-027",
    "claimant_name": "Anacletus II",
    "slug": "anacletus-ii-27",
    "claim_period": "1130–1138",
    "status": "antipope",
    "included_in_canonical_popes": false,
    "notes": "In opposition to Innocent II."
  },
  {
    "antipope_id": "antipope-028",
    "claimant_name": "Victor IV",
    "slug": "victor-iv-28",
    "claim_period": "1138",
    "status": "antipope",
    "included_in_canonical_popes": false,
    "notes": "Successor in the Anacletus line."
  },
  {
    "antipope_id": "antipope-029",
    "claimant_name": "Victor IV",
    "slug": "victor-iv-29",
    "claim_period": "1159–1164",
    "status": "antipope",
    "included_in_canonical_popes": false,
    "notes": "Imperial antipope in opposition to Alexander III."
  },
  {
    "antipope_id": "antipope-030",
    "claimant_name": "Paschal III",
    "slug": "paschal-iii-30",
    "claim_period": "1164–1168",
    "status": "antipope",
    "included_in_canonical_popes": false,
    "notes": "In opposition to Alexander III."
  },
  {
    "antipope_id": "antipope-031",
    "claimant_name": "Callixtus III",
    "slug": "callixtus-iii-31",
    "claim_period": "1168–1178",
    "status": "antipope",
    "included_in_canonical_popes": false,
    "notes": "In opposition to Alexander III; not the later canonical Callixtus III."
  },
  {
    "antipope_id": "antipope-032",
    "claimant_name": "Innocent III",
    "slug": "innocent-iii-32",
    "claim_period": "1179–1180",
    "status": "antipope",
    "included_in_canonical_popes": false,
    "notes": "In opposition to Alexander III; not the later canonical Innocent III."
  },
  {
    "antipope_id": "antipope-033",
    "claimant_name": "Nicholas V",
    "slug": "nicholas-v-33",
    "claim_period": "1328–1330",
    "status": "antipope",
    "included_in_canonical_popes": false,
    "notes": "In opposition to John XXII."
  },
  {
    "antipope_id": "antipope-034",
    "claimant_name": "Clement VII",
    "slug": "clement-vii-34",
    "claim_period": "1378–1394",
    "status": "antipope",
    "included_in_canonical_popes": false,
    "notes": "Avignon claimant during the Western Schism."
  },
  {
    "antipope_id": "antipope-035",
    "claimant_name": "Benedict XIII",
    "slug": "benedict-xiii-35",
    "claim_period": "1394–1423",
    "status": "antipope",
    "included_in_canonical_popes": false,
    "notes": "Avignon claimant during the Western Schism."
  },
  {
    "antipope_id": "antipope-036",
    "claimant_name": "Alexander V",
    "slug": "alexander-v-36",
    "claim_period": "1409–1410",
    "status": "antipope",
    "included_in_canonical_popes": false,
    "notes": "Pisan claimant; reclassified as antipope."
  },
  {
    "antipope_id": "antipope-037",
    "claimant_name": "John XXIII",
    "slug": "john-xxiii-37",
    "claim_period": "1410–1415",
    "status": "antipope",
    "included_in_canonical_popes": false,
    "notes": "Pisan claimant; reclassified as antipope."
  },
  {